{
  "$schema": "http://json-schema.org/draft-07/schema#",
  "$ref": "#/definitions/Potion",
  "definitions": {
    "Potion": {
      "type": "object",
      "properties": {
        "id": {
          "type": "string"
        },
        "name": {
          "type": "string"
        },
        "description": {
          "type": "string"
        },
        "effect": {
          "type": "string"
        },
        "rarity": {
          "type": "number"
        },
        "craft": {
          "type": "object",
          "properties": {
            "cost": {
              "type": "number"
            },
            "items": {
              "type": "array",
              "items": {
                "type": "object",
                "properties": {
                  "id": {
                    "type": "string"
                  },
                  "name": {
                    "type": "string"
                  },
                  "amount": {
                    "type": "number"
                  }
                },
                "required": [
                  "id",
                  "name",
                  "amount"
                ],
                "additionalProperties": false
              }
            }
          },
          "required": [
            "cost",
            "items"
          ],
          "additionalProperties": false
        },
        "version": {
          "type": "string"
        }
      },
      "required": [
        "id",
        "name",
        "description",
        "effect",
        "rarity",
        "craft"
      ],
      "additionalProperties": false
    }
  }
}