{
  "id": "HeatshieldPotion",
  "name": "Potion de résistance Pyro",
  "description": "Une potion mystérieuse qui permet de résister aux environnements à haute température et augmente la RÉS Pyro. Son principe d'action consiste à adapter le corps à la chaleur plutôt que de le refroidir.",
  "effect": "Augmente la RÉS Pyro de tous les personnages de l'équipe de 25 % pendant 300 s.",
  "craft": {
    "cost": 100,
    "items": [
      {
        "id": "ButterflyWings",
        "name": "Ailes de papillon",
        "amount": 1
      },
      {
        "id": "FlamingFlowerStamen",
        "name": "Pistil de fleur enflammée",
        "amount": 1
      }
    ]
  },
  "rarity": 3,
  "version": "1.6"
}